{
  "schema_version": "1.0.0",
  "regulation_id": "TEST-B",
  "regulation_revision": "synthetic-v1",
  "expected_member_count": 3,
  "source_manifest_ids": ["synthetic-catalog-intake"],
  "members": [
    {"national_dex_no": 1, "form_code": "00", "variant_code": "0", "label": "No.0001 アルファ", "pokemon_id": null},
    {"national_dex_no": 2, "form_code": "00", "variant_code": "0", "label": "No.0002 ベータ", "pokemon_id": null},
    {"national_dex_no": 3, "form_code": "00", "variant_code": "0", "label": "No.0003 ガンマ", "pokemon_id": null}
  ]
}
